Tipo|Medio General|Medio Específico|Título|Resumen|Fecha Emisión|Valorización|Cm2|Duración|Página|Personajes|Candidatos 2016|Tono|Mes Emisión
Web|Exitosa|exitosadiario.pe|Villarán participará en elecciones: ""Quiero evitar que el fujimorismo regrese""|La exalcaldesa de Lima, Susana Villarán, anunció hoy que ha decidido participar en las próximas elecciones generales. Detalló que está en conversaciones con varios partidos políticos.. .A través de su página en Facebook, Villarán adelantó que hará todo lo que esté en sus manos para evitar que la candidata Keiko Fujimori llegue a ser presidenta de la República. “Pondré mi energía, mi pasión, mi vida, mi chalina verde de la esperanza en ese empeño”, puntualizó. Villarán, quien hace unos días renunció a Fuerza Social, reveló que ya ha conversado con los líderes políticos César Acuña, Pedro Pablo Kuczynski, Alfredo Barrenechea, Ántero Flores-Aráoz y Yehude Simon. Precisó que hoy hará lo propio con Julio Guzmán.|12/12/2015|71.5||0||Susana María del Carmen Villarán de la Puente|Ántero Flores-Aráoz Esparza|Neutro|2015-12
Web|Canal N|canaln.pe|Susana Villarán confirmó su participación en las elecciones del 2016|Susana Villarán, anunció su participación en las elecciones generales del 2016. A través de su cuenta de Facebook manifestó que pese a que había decidio lo contrario, lo hará ante la posible llegada del fujimorismo a la presidencia de la República. (...)No obstante, Susana Villarán no precisó con qué partido político participará en los comicios, sin embargo, dijo que ha conversado con líderes como César Acuña, Pedro Pablo Kuczynski, Ántero Flores Aráoz, Yehude Simon y Alfredo Barrenechea.|12/12/2015|104||0||Susana María del Carmen Villarán de la Puente|Ántero Flores-Aráoz Esparza|Neutro|2015-12
Web|Correo|diariocorreo.pe|Elecciones 2016: Rómulo Mucho se une al partido ORDEN de Antero Flores|Después de no haber conciliado un acuerdo con Peruanos por el Cambio (PPK), Rómulo Mucho, líder del grupo político Perú en Acción, informó en conferencia de prensa que postulará en las próximas elecciones del 2016 como vicepresidente de la República por el partido ORDEN, liderado por Antero Flores Araoz. (...) “El Gobierno no sacó adelante proyectos mineros, no hizo el esfuerzo, si lo hubiera hecho distinto sería el panorama económico del Perú”, dijo durante su presentación y agregó: “garantizo que las minas no van a contaminar, puedo firmar con mi sangre. Tía María debió salir en el 2009, en el 2011 debió producir, cuánto de canon más hubiéramos recibido, puestos de trabajo...”. Mencionó invertir en los proyectos Ocoña, Molloco, Lluta y Lluclla. Además de los proyectos mineros Tía María y Conga como solución a la crisis económica. “Si se hubiera invertido de manera adecuada no estaríamos en esta situación”,dijo.|13/12/2015|702.1||0||Rómulo Mucho Mamani|Ántero Flores-Aráoz Esparza|Positivo|2015-12
Medio Impreso|Trome|Trome|Villarán en reuniones|La exalcaldesa de Lima, Susana Villarán, quien hace días renunció a Fuerza Social, partido que ella misma fundó, aseguró que de todas maneras participará en las elecciones del próximo año con su chalina verde para ""evitar que el fujimontesinismo regrese"". Afirmó que por eso se ha reunido con César Acuña, Pedro Pablo Kuczynski, Alfredo Barnechea, Antero Flores-Aráoz, Yehude Simon, y líderes de Izquierda. Anunció que luego lo hará con Julio Guzmán. Dijo que su decisión la dará a conocer oportunamente.|13/12/2015|1209.63|55.99|0|10|Susana María del Carmen Villarán de la Puente|Ántero Flores-Aráoz Esparza|Neutro|2015-12
Medio Impreso|La República|La República - Suplemento Domingo|Promesas 2016 - Renato Cisneros|Ver de una vez por todas «El Despertar de la Fuerza» y dejar de sufrir los comentarios sembrados en las redes por maliciosos spoilers que no se compadecen de los fans de «Star Wars» que no hemos podido ver aún el nuevo episodio de la saga. He leído por ahí que muere Han Solo. Espero que se trate de una broma. Festejar con moderación los cuarenta años de mi nacimiento y, al hacerlo, colgar simbólicamente los chimpunes de los viejos desbandes con que antes solía homenajear esa efeméride. Casarme con Natalia delante de un código civil y, dos días después, delante de una gran cruz, y bailar el vals con empeñoso decoro frente a los invitados, y luego brindar con ellos y allí sí ahondar en los excesos con que es menester celebrar los acontecimientos felices que uno juzga definitivos. No votar por Keiko, ni por Alan, ni por Acuña, ni por Urresti, ni por Toledo, ni por Ántero, ni por Belmont, ni por Gregorio Santos, ni por Yehude, ni por Reggiardo, ni por Nano, ni por Julio Guzmán, ni por Verónika Mendoza, ni por los otros pitufos. Ni en primera ni en segunda vuelta.|27/12/2015|2549.04|817.44|0|23|Renato Cisneros|Ántero Flores-Aráoz Esparza|Negativo|2015-12
Radio|Exitosa|Exitosa Domingo|Entrevista a Rómulo Mucho, candidato a la vicepresidencia por el partido Orden (Exitosa)|Entrevista. Rómulo Mucho, candidato a la vicepresidencia por el partido Orden, comentó sobre su postulación. Asimismo, señaló que hay que trabajar bastante junto a Antero Flores Araoz para subir en las encuestas. Además, indicó que ha presentado una propuesta para que el canon sea utilizada para la educación.|20/12/2015|3320.73||1757||Rómulo Mucho Mamani|Ántero Flores-Aráoz Esparza|Positivo|2015-12
Web|RPP|rpp.com.pe|Susana Villarán anunció que participará en las elecciones del 2016|La exalcaldesa de Lima Susana Villarán anunció su participación en las elecciones generales del 2016, con el objetivo de evitar que el fujimorismo regrese al poder. (...) Villarán adelantó que aún evalúa con qué partido participará en los comicios del próximo año, pero admite haberse reunido con líderes como César Acuña, Pedro Pablo Kuczynski, Ántero Flores Aráoz, Yehude Simon y Alfredo Barrenechea.|12/12/2015|1700.92||0||Susana María del Carmen Villarán de la Puente|Ántero Flores-Aráoz Esparza|Neutro|2015-12
Medio Impreso|El Chino|El Chino|Villarán dice que conversa con Acuña y PPK|La exalcaldesa de Lima Susana Villarán aseguró que ""participará en las elecciones"" del próximo año para ""evitar que el fujimontesinismo, ahora encarnado en Keiko Fujimori, regrese al poder"", Villarán informó que ha conversado con César Acuña y Pedro Pablo Kuczynski (PPK), entre otros candidatos presidenciales, pero aún no ha tomado una decisión, ""Con qué agrupación iré? Algunos de mis interlocutores en estas conversaciones me han invitado a acompañarlos"", agregó,|13/12/2015|465.01|98.43|0|5|Susana María del Carmen Villarán de la Puente|Ántero Flores-Aráoz Esparza|Neutro|2015-12
Medio Impreso|La República|La República|Perú Wars: El Despertar a la Fuerza - Marco Sifuentes|¿Ya pasaron las náuseas, Perú? ¿O todavía seguimos contemplando con estupor ese chocolateo de lealtades, ese festival de traiciones, esa radiografía del subdesarrollo también conocida como la lista de las 17 planchas de candidatos a la presidencia y vicepresidencia de nuestro país? Más allá del gravol, veamos algunas conclusiones en borrador. –Algo inédito: hasta los pitufos son parte del elenco estable. No hay (casi) pitufos desconocidos. Belmont, Yehude, Nano, Ántero, Goyo, Barnechea o Urresti son personajes que tranquilamente podrían obtener 2%. No les serviría, por supuesto, para pasar la valla del 5%. Así, la mayor amenaza para Keiko Fujimori, en la primera vuelta, no se encuentra en ninguno de los otros 16 candidatos. Estos saben que 1) no tienen forma de desplazarla y 2) les convendría más jugar a ser el mal menor ante Keiko en la segunda vuelta.|23/12/2015|2452.21|292.79|0|5|Marcos Sifuentes|Ántero Flores-Aráoz Esparza|Neutro|2015-12
Medio Impreso|Diario Uno|Diario Uno|El voto inesperado - César Lévano|La encuestadora lmasen halló una sorpresa en su sondeo llevado a cabo entre el 26 de noviembre y el 1 de diciembre. A la pregunta: ¿usted votaría por alguien de izquierda para la presidencia de la República?"", 7.2 por ciento respondió: ""definitivamente sí"", y 19.5 declaró: ""probablemente sí"". En suma, un potencial 26.7 por ciento (...) Por lo demás, Imasen confirma en sus puestos a los candidatos favoritos de la Conferencia Anual de Empresarios (CADE). Keiko Fujimori está en la punta, con 33.2 por ciento. Le siguen PPK, con 15.4; César Acuña, con 10.9 y Alan García, con 8.6. Alejandro Toledo obtuvo 4.6 y Verónika Mendoza 2.0. En la lista que, bajo el rubro de otros, cosecha colectivamente 2.8 por ciento figuran Ántero Flores-Aráoz, Romulo Mucho, Miguel Hilario, Renzo Reggiardo, Julio Guzmán, Alfredo Barnechea, José Luna, Gonzalo García, Nono Guerra Garcia, Ricardo Belmont y Hernando de Soto|04/12/2015|2339.75|245.78|0|2|César Lévano|Ántero Flores-Aráoz Esparza|Neutro|2015-12
Televisión|Canal ATV Plus|Hora Clave|Entrevista al analista político Eugenio D'Medina (ATV+)|Entrevista. El analista político Eugenio D'Medina comentó sobre la coyuntura política. En ese sentido, señaló que a Alan García no le suma mucho la alianza con el PPC. De otro lado, indicó que la presencia de Mercedes Aráoz en la plancha presidencial de Pedro Pablo Kuczynski no le añade algo distinto. Sobre el fujimorismo, consideró que hay un entorno dentro de Fuerza Popular que está manipulando a Keiko Fujimori. En cuanto a César Acuña, sostuvo que de todos los candidatos es el que más deseos tiene de ganar, y eso lo hace un candidato muy potente. Añadió que en un país con mucho analfabetismo, acusarlo de no saber leer le favorece. De Daniel Urresti opinó que es el candidato enviado para ensuciar la campaña, y lo comparó como un “perro callejero enfermo con la rabia”. En otro momento, refirió que Alejandro Toledo puede ser sobrepasado muy pronto por Verónika Mendoza o Ántero Flores-Aráoz. Finalmente, pidió que algunos de los candidatos ponga en agenda el tipo de Poder Judicial que necesitamos.|18/12/2015|7160||1432||Eugenio D´Medina Lora|Ántero Flores-Aráoz Esparza|Neutro|2015-12
Medio Impreso|El Comercio|El Comercio Cuerpo A|Las fórmulas del 2016 - Hugo Guerra|Quisiera celebrar el advenimiento del nuevo año con optimismo, pero cuando analizo la política nacional solo puedo avizorar el 2016 con recelo. La campaña electoral, hasta este punto, es un desastre , con pocas excepciones. La falta de consistencia ideológica , organización y trayectoria de la mayor parte de instituciones participantes (increíblemente 19 fórmulas) ratifica que prácticamente carecemos de partidos políticos , pero abundan los clubes electorales oportunistas que se aprestan no a tomar el poder , sino a asaltar el Estado. (...) Así, solo quedan tres opciones razonables: PPK ofrece una alternativa interesante y viable, pese a la presencia de gente de tercer nivel en su lista. Keiko Fujimori es también atendible porque, aunque cueste decirlo, ella no es lo mismo que su corrupto padre.|28/12/2015|2981.55|325.64|0|16|Hugo Guerra Arteaga|Ántero Flores-Aráoz Esparza|Negativo|2015-12
Web|El Comercio|elcomercio.pe|Las fórmulas del 2016 - Hugo Guerra|En cuanto a Alfredo Barnechea, es mucho candidato para un partido querido pero maltratado como Acción Popular. Los demás postulantes pequeños, Ántero Flores-Aráoz, Renzo Reggiardo y Julio Guzmán quizá en el 2021 sean una opción...Así, solo quedan tres opciones razonables: PPK ofrece una alternativa interesante y viable, pese a la presencia de gente de tercer nivel en su lista. Keiko Fujimori es también atendible porque, aunque cueste decirlo, ella no es lo mismo que su corrupto padre. Además, cuenta con el apoyo de un hombre muy valioso como José Chlimper, aunque la participación de Vladimiro Huaroc es absurda, lo mismo que el maltrato a personalidades como Martha Chávez.|28/12/2015|5994.53||0||Hugo Guerra Arteaga|Ántero Flores-Aráoz Esparza|Negativo|2015-12
Web|Perú.com|peru.com|Susana Villarán sí participará en elecciones contra el fujimorismo|La exalcaldesa de Lima Susana Villarán, a través de su cuenta de Facebook, anunció que participará en las Elecciones 2016 , a pesar que dijo en reiteradas oportunidades que no lo haría.. “Seguiré conversando con líderes políticos para unir esfuerzos y evitar que el fujimontesinismo regrese, ahora encarnado en Keiko. Lo he hecho hasta hoy con César Acuña, con PPK, con Alfredo Barnechea, con Antero Flores Araoz, con Yehude Simon, con muchos líderes y lideresas de base de las izquierdas en el país. Hoy lo haré con Julio Guzmán”, continuó su anunció.|12/12/2015|1975.45||0||Susana María del Carmen Villarán de la Puente|Ántero Flores-Aráoz Esparza|Neutro|2015-12
Medio Impreso|Perú 21|Perú 21|Enanitos verdes - Juan José Garrido|A diferencia de elecciones pasadas, estas traen a un pelotón “visible” de candidatos y a uno “invisible”, esos candidatos enanos que se encuentran cerca o por debajo del 1%. Hay de todo tipo, como en botica: conocidos y desconocidos, liberales y progresistas, viejos y jóvenes, y así. De estos candidatos enanos, la única que ha mejorado sustancialmente en los últimos meses es Verónika Mendoza, quien ha pasado del 0.4% de octubre al 2% en diciembre. Aunque difícil, si continúa la tendencia podría pasar la valla; no sería poco para ella, y tampoco para su bancada (¡ya podemos imaginar la algarabía de los antimineros con bancada propia el 2016!). Otro que ha crecido es Ántero Flores-Aráoz: pasó del 0.5% en octubre al 1% en diciembre.|12/12/2015|1705.03|199.87|0|4|Juan José Garrido|Ántero Flores-Aráoz Esparza|Neutro|2015-12
Web|Capital|capital.com.pe|Susana Villarán participará en las elecciones 2016|La exalcaldesa de Lima Susana Villarán anunció su participación en las elecciones generales del 2016, con el objetivo de evitar que el fujimorismo regrese al poder. (...) Villarán adelantó que aún evalúa con qué partido participará en los comicios del próximo año, pero admite haberse reunido con líderes como César Acuña, Pedro Pablo Kuczynski, Ántero Flores Aráoz, Yehude Simon y Alfredo Barrenechea.|12/12/2015|54.41||0||Susana María del Carmen Villarán de la Puente|Ántero Flores-Aráoz Esparza|Neutro|2015-12
Televisión|Canal N|N Noticias|Susana Villarán anunció que participará en las próximas elecciones (Canal N)|La exalcaldesa Susana Villarán anunció a través de su cuenta de Facebook que hará todo lo que esté en sus manos para evitar que el fujimorismo regrese al gobierno. Aseveró que seguirá conversando con líderes políticos para unir esfuerzos a fin de evitar que el fujimorismo regrese, ahora encarnado en Keiko Fujimori. Reveló que ha dialogado con César Acuña, Pedro Pablo Kuczynski, Alfredo Barnechea, Ántero Flores-Aráoz entre otros. Señaló que ha tomado la decisión de participar en las próximas elecciones. Mediante un enlace telefónico, Marco Tulio Gutiérrez sostuvo que esta es la segunda vez que Villarán incumple su palabra.|12/12/2015|9114||651||Susana María del Carmen Villarán de la Puente|Ántero Flores-Aráoz Esparza|Neutro|2015-12
Web|La República|larepublica.pe|Susana Villarán confirma que participará en elecciones del 2016|A través de su cuenta Facebook, la exalcaldesa de Lima Susana Villarán anunció su participación en las elecciones generales del 2016, con lo cual manifiesta un cambio de opinión. ¿Por qué? Ella cuenta que el peligro de que el fujimorismo vuelva al poder la llevó a tomar esta decisión.. Villarán de la Puente no precisa con qué partido político participará en los comicios, no dijo si será como candidata a la presidencia o al Congreso de la República, pero menciona haberse reunido con líderes como César Acuña, Pedro Pablo Kuczynski, Ántero Flores Aráoz, Yehude Simon y Alfredo Barrenechea..|12/12/2015|1014.43||0||Susana María del Carmen Villarán de la Puente|Ántero Flores-Aráoz Esparza|Neutro|2015-12
Web|Correo|diariocorreo.pe|?Susana Villarán anuncia participación en elecciones 2016|Tras haber renunciado a las filas de Fuerza Social, la exalcaldesa de Lima, Susana Villarán, anunció a través de las redes sociales que participará en las elecciones del 2016, aunque no dijo con qué agrupación política irá. (...) Afirmó que ya ha tenido conversaciones con diferentes líderes políticos, tales como César Acuña, PPK, Ántero Flores Aráoz, entre otros. ""Algunos de mis interlocutores en estas conversaciones me han invitado a acompañarlos con generosidad que agradezco sinceramente. Cuando tome definitivamente esa decisión se los haré saber"", remarcó.|12/12/2015|702.1||0||Susana María del Carmen Villarán de la Puente|Ántero Flores-Aráoz Esparza|Neutro|2015-12
Medio Impreso|Correo|Correo|APRA negocia alianzas con partidos de Renzo Reggiardo y Flores-Aráoz|A una semana para que culmine el plazo para la inscripción de alianzas electorales, el APRA empezó a pisar el acelerador en sus negociaciones con otros partidos políticos. Al respecto. el congresista Mauricio Mulder informó que su agrupación ""está avanzando'' en las conversaciones con Vamos Perú. cuyo lideres el actual alcalde del Callao, Juan Sotomayor . (...) ""Yo soy una alternativa (de candidato) pero preferimos nosotros. por la premura del tiempo, ir en alianza. Nosotros tenemos propuestas del APRA. PPK y Acuña. Todos quieren a Solidaridad por lo que representa en Lima, pero este lunes tendremos la decisión"", afirmó a Correo.|04/12/2015|3796.9|397.81|0|6|Claude Maurice Mulder Bedoya|Ántero Flores-Aráoz Esparza|Neutro|2015-12
Web|Correo|diariocorreo.pe|APRA negocia alianzas con partidos de Renzo Reggiardo y Flores-Aráoz|Según adelantó la vocera de bancada, Esther Capuñay, hay tres precandidatos: el constitucionalista Alberto Borea, el congresista José Luna y el expremier César Villanueva...Sin embargo, Luna informó que su partido “está evaluando la posibilidad de una alianza”...“Yo soy una alternativa (de candidato) pero preferimos nosotros, por la premura del tiempo, ir en alianza. Nosotros tenemos propuestas del APRA, PPK y Acuña. Todos quieren a Solidaridad por lo que representa en Lima, pero este lunes tendremos la decisión”, afirmó a Correo.|04/12/2015|702.1||0||Claude Maurice Mulder Bedoya|Ántero Flores-Aráoz Esparza|Neutro|2015-12
Medio Impreso|Perú 21|Perú 21|""Tenemos un gobierno inepto y corrupto""|Entrevista a Fernando Rospigliosi. Ex ministro del Interior y analista político. ¿De eso se trata la política, de ser profesional independiente y exitoso? Es una característica que tiene la plancha de Pedro Pablo Además, es gente que ha trabajado en la administración pública y lo ha hecho bien. (...) Usted conversó con Keiko, ¿lo ’choteó’? Para nada. He conversado también con Alan García, con Ántero Flores-Aráoz, con mucha gente. (...) Claro, pero ¿no están repitiendo lo de Toledo: Un gobierno de todas las sangres? Eso fue lo que dijo Pedro Pablo en la CADE. No es copiar a Toledo trabajar con gente honrada y honesta para un eventual gobierno (...) ¿Acuña gasta en exceso? De eso no hay duda, se ha gastado millones en una campaña publicitaria a nombre de la universidad cuando es obvio que está haciendo propaganda política. Tiene muchísima plata. Pero ese es un problema del JNE.|20/12/2015|16654.96|1617.89|0|2|Fernando Miguel Rospigliosi Capurro|Ántero Flores-Aráoz Esparza|Neutro|2015-12
Web|Perú 21|peru21.pe|Luis Iberico: “Universidades pueden aportar a la campaña”|Entrevista. Luis Iberico, secretario ejecutivo nacional de Alianza para el Progreso (APP). (...) ¿Qué responde ante las denuncias contra César Acuña por los aportes fantasmas a su campaña?.Todo tiene que esclarecerse en aras de la transparencia. No tenemos ánimo de ocultar nada, somos los primeros interesados en hacer una investigación interna y nos allanamos también a las investigaciones que se hacen desde afuera.|18/12/2015|1874.83||0||Luis Carlos Antonio Iberico Nuñez|Ántero Flores-Aráoz Esparza|Neutro|2015-12
Web|La República|larepublica.pe|El beso de drácula - Augusto Álvarez Rodrich|¿Qué culpa tengo de que no tenga universidades? César Acuña.|14/12/2015|1014.43||0||Augusto Álvarez Rodrich|Ántero Flores-Aráoz Esparza|Neutro|2015-12
Web|Andina|andina.com.pe|Susana Villarán anuncia que participará en las elecciones 2016|La exalcaldesa de Lima Susana Villarán anunció hoy que participará en las elecciones generales del 2016, luego de haber presentado esta semana su renuncia a las filas de Fuerza Social, partido con el que llegó a la alcaldía capitalina. (...) ""Lo he hecho hasta hoy con César Acuña, con PPK, con Alfredo Barnechea, con Ántero Flores-Aráoz, con Yehude Simon, con muchos líderes y lideresas de base de las izquierdas. Hoy lo haré con Julio Guzmán. Persistiré en ello"", agregó.|12/12/2015|98.6||0||Susana María del Carmen Villarán de la Puente|Ántero Flores-Aráoz Esparza|Neutro|2015-12
Medio Impreso|Perú 21|Perú 21|""La actual Constitución ha funcionado bien""|Entrevista Rómulo Mucho, candidato a primer vicepresidente de Orden. Rómulo Mucho no pudo lograr la inscripción de su partido, Perú en Acción, en el Jurado Nacional de Elecciones (JNE) y, cuando pretendió postular a la presidencia con otra agrupación, lo desembarcaron de ella. A pesar de esto, participará en la campaña política del 2016 candidateando en la primera vicepresidencia de Orden. También postulará al Congreso por Lima. (…) Como todos saben, yo empecé con un nuevo movimiento, pero no alcanzamos las firmas. ¿Por qué con Orden? Porque conozco a Ántero Flores-Aráoz de hace muchos años, cuando fui congresista en el año 2000. Sé que es una persona seria, centrada en combatir la inseguridad ciudadana y la corrupción.|28/12/2015|10548.67|1135.98|0|14|Rómulo Mucho Mamani|Ántero Flores-Aráoz Esparza|Positivo|2015-12
Web|Perú 21|peru21.pe|César Acuña descartó incorporación de Susana Villarán a su agrupación política|El candidato presidencial de Alianza para el Progreso, César Acuña, descartó hoy una eventual incorporación de la exalcaldesa de Lima, Susana Villarán a su agrupación política las elecciones generales de 2016...(...) El candidato presidencial de Alianza para el Progreso, César Acuña, descartó hoy una eventual incorporación de la exalcaldesa de Lima, Susana Villarán a su agrupación política las elecciones generales de 2016.|13/12/2015|1874.83||0||Susana María del Carmen Villarán de la Puente|Ántero Flores-Aráoz Esparza|Neutro|2015-12
Web|La República|larepublica.pe|Fujimorismo vs. fujimorismo|Hace unos días tuve el gusto de conversar con Alberto Vergara, reconocido politólogo peruano. Algo que me dijo me llamó la atención: “Los peruanos no necesitamos de un Fujimori para ser gobernados de un modo fujimorista”. El clientelismo que compra votos, la facilidad de privatizar antes que planificar, todo eso lo vemos en muchos candidatos ahora. ¿Qué representa César Acuña, si no todo lo descrito? .Con esto en mente es que quiero expresar mi opinión a raíz de las declaraciones de Susana Villarán. . .Creo que toda conversación es válida y enriquece. Escuchar a otros y enfrentar ideas es siempre saludable. Que Susana Villarán haya conversado con otras fuerzas (ella misma menciona: Acuña, PPK, Ántero) no es el problema.|15/12/2015|1014.43||0||Sigrid Bazán Narro|Ántero Flores-Aráoz Esparza|Neutro|2015-12
Medio Impreso|Diario Uno|Diario Uno|Indecisos; la mayoría - César Lévano|La encuesta de GfK publicada ayer en La República muestra que Keiko Fujimori sigue en la punta de la intención de voto, pero ha bajado dos puntos: de 32 a 30 por ciento. Hay, en cambio, un 36 por ciento que aún no decide su voto o indica que votaría en blanco o viciado. Alan García, después de su publicitada alianza con el PPC, sigue hundiéndose. Ahora está en cinco por ciento, frente al 11 de PPK, el 8 de César Acuña y el 3 de Alejandro Toledo. Bajo el rubro de Otros, con dos por ciento cada uno, aparecen Verónika Mendoza, Julio Guzmán y Daniel Urresti. Más abajo, con 0.2 por ciento, queda Ántero Flores-Aráoz.|21/12/2015|2292|240.65|0|2|César Lévano|Ántero Flores-Aráoz Esparza|Neutro|2015-12
Web|Correo|diariocorreo.pe|2016: Un año de definiciones - Juan Carlos Valdivia|(...) Hay una vasta oferta electoral, dispersa, que debió consolidarse en una o dos propuestas. Pero cuando tenga que elegir su candidato, escoja entre aquellos que nos garanticen que no se desandará lo andado, que nos afirmen que los cambios que proponen son para consolidar el modelo económico y no para implantar uno diferente. Hay de donde escoger, desde PPK o Alan García, pasando por Keiko Fujimori, Julio Guzmán, Ántero Flórez, Alfredo Barnechea y quizá César Acuña.|30/12/2015|702.1||0||Juan Carlos Valdivia|Ántero Flores-Aráoz Esparza|Neutro|2015-12
