Tipo|Medio General|Medio Específico|Título|Resumen|Fecha Emisión|Valorización|Cm2|Duración|Página|Personajes|Candidatos 2016|Tono|Mes Emisión
Web|La República|larepublica.pe|Andrés Alcántara: “No me cabe duda de que Gregorio Santos es un preso político de las trasnacionales”|Entrevista. Andrés Alcántara, postulante a la vicepresidencia de la República. (...) Su candidato presidencial es el exgobernador regional de Cajamarca Gregorio Santos. Él actualmente está preso en Piedras Gordas y se le acusa por presuntos delitos de cohecho pasivo, asociación ilícita para delinquir y colusión en agravio del Estado. ¿Cómo van a lograr todas sus propuestas? .Esos son ataques de la prensa y del Poder Judicial. Eso es lo que uno se gana por enfrentarse a las trasnacionales. Gregorio Santos no tiene sentencia. Él está preso por subjetividad, porque creen que se puede fugar del país. Toda persona es considerada inocente mientras no se haya declarado judicialmente su responsabilidad.|28/12/2015|1014.43||0||Andrés Alcántara Paredes|Gregorio Santos Guerrero|Positivo|2015-12
Medio Impreso|Correo|Correo|Macondo Electoral - Iván Slocovich Pardo|No hay duda de que, con lo visto en las últimas horas en el panorama electoral peruano, la desmesurada y genial imaginación de Gabriel García Márquez, uno de los padres del realismo mágico en Latinoamérica -esa corriente literaria donde lo extraño, absurdo e inimaginable sucede como si nada y sin que nadie levante una ceja-, ha quedado chica, pues las postulaciones de Nano Guerra García, el preso Gregorio Santos y Susana Villarán escapan de todo lo previsible y lógico. Comencemos con Guerra Garáa, quien hasta hace unos ellas era el casi anónimo precanctidato presidencial del Partido Humanista hasta que el líder de esta agrupación. Yehude Simon. decidió bajarle el dedo por ""no hacer clic"" con los electores. Ahora el hombre ha sido acogido por Solidaridad Nacional, cuyo dueño parece ser José Luna, quien antes quiso aliarse con Pedro Pablo Kuczynski, pero fue rechazado por pedir demasiado a cambio de aportar poco o nada a los “pepekausas”. Avanzaba la tarde de ayer y se confirmó que Susana Villarán, la autoproclamada reserva moral de la política peruana, defensora de los derechos humanos y constructora de ciudadanía, iba en la plancha de Daniel Urresti (procesado por asesinato), del Partido Nacionalista, cuya lideresa no puede explicar de dónde saca la plata.|21/12/2015|1807.59|189.86|0|11|Iván Slocovich Pardo|Gregorio Santos Guerrero|Negativo|2015-12
Web|Exitosa|exitosadiario.pe|""Incorporación de Meche Aráoz confirma que Peruanos por el Kambio es el partido de lobbistas""|Entrevista. Marco Arana, candidato a la vicepresidencia por Frente Amplio. (...) Usted señaló que le preocupa que César Acuña gane la Presidencia y entre a saquear al Estado…. .Hay tres cosas graves. Que el señor Acuña está procesado por usar fondos públicos cuando fue alcalde para conseguir votos. ¿El Poder Judicial está amarrado de manos o es cómplice? ¿El Jurado Nacional de Elecciones qué dice al respecto? ¿O el señor Acuña está teniendo el padrinazgo de las altas esferas del poder? Segundo: todas las investigaciones de sus fondos. Yo no tengo nada contra un señor que hace fortuna, pero el origen de esos fondos ¿cuándo se va a investigar? Y tercero: está metido en negocios de educación que como sabemos tienen exoneración tributaria, entonces ¿cómo es posible que usen este negocio para una campaña multimillonaria y eso genera una desventaja en la competencia electoral? ¿Dónde está la Sunat?|26/12/2015|71.5||0||Marco Antonio Arana Zegarra|Gregorio Santos Guerrero|Negativo|2015-12
Medio Impreso|Correo|Correo|Fuera los terrucos - Iván Slocovich Pardo|Si ya tenemos una contienda electoral propia de una novela salida del realismo mágico con Susana Villarán al lado de Daniel Urresti, Anel Townsend cambiándose nuevamente de camiseta y a Gregorio Santos haciendo campaña presidencial desde el patio de Piedras Gordas; cuidado con que en medio de todo esto el Jurado Nacional de Elecciones (JNE) acepte la inscripción de una agrupación de fachada de la banda terrorista Sendero Luminoso.|23/12/2015|1941.49|203.57|0|11|Iván Slocovich Pardo|Gregorio Santos Guerrero|Negativo|2015-12
Medio Impreso|La República|La República - Suplemento Domingo|Promesas 2016 - Renato Cisneros|Ver de una vez por todas «El Despertar de la Fuerza» y dejar de sufrir los comentarios sembrados en las redes por maliciosos spoilers que no se compadecen de los fans de «Star Wars» que no hemos podido ver aún el nuevo episodio de la saga. He leído por ahí que muere Han Solo. Espero que se trate de una broma. Festejar con moderación los cuarenta años de mi nacimiento y, al hacerlo, colgar simbólicamente los chimpunes de los viejos desbandes con que antes solía homenajear esa efeméride. Casarme con Natalia delante de un código civil y, dos días después, delante de una gran cruz, y bailar el vals con empeñoso decoro frente a los invitados, y luego brindar con ellos y allí sí ahondar en los excesos con que es menester celebrar los acontecimientos felices que uno juzga definitivos. No votar por Keiko, ni por Alan, ni por Acuña, ni por Urresti, ni por Toledo, ni por Ántero, ni por Belmont, ni por Gregorio Santos, ni por Yehude, ni por Reggiardo, ni por Nano, ni por Julio Guzmán, ni por Verónika Mendoza, ni por los otros pitufos. Ni en primera ni en segunda vuelta.|27/12/2015|2549.04|817.44|0|23|Renato Cisneros|Gregorio Santos Guerrero|Negativo|2015-12
Medio Impreso|La República|La República|Fotochek de apuestas riesgosas - Mriko Lauer|Lourdes Flores. Fue buscada para levantar los bonos del Apra, y si esos bonos no suben ella va a sufrir los reproches de los dos partidos. En verdad la pelea interna del PPC se va a decidir en abril 2016. Si su perspectiva es volver al Congreso, por cierto que será un premio menor. ¿Obtendrá el primer lugar en la lista? Ántero Flores-Aráoz. Se está jugando un huachito radical. Él mismo declara que está candidateando por el placer de la competencia democrática. Como una suerte de generoso aviso luminoso de sí mismo. ¿Quién convenció a este hombre afable de que cartelones con horribles amenazas de la mano dura funcionan para una elección? Fernando Olivera. La suya ni siquiera es una apuesta riesgosa, sino un gambito de pérdida segura. Cuatro meses de vacilón politico, quizás con el propósito de reinstalarse como hombre-denuncia en el mercado. Pero en esto la competencia es dura, y él parece un poco fuera de práctica. Quizás Alejandro Toledo lo puede necesitar.|27/12/2015|1375.29|240.09|0|4|Mirko Lauer|Gregorio Santos Guerrero|Neutro|2015-12
Medio Impreso|Diario Uno|Diario Uno|Verónika es la opción de la izquierda|La ex regidora limeña, Marisa Glave descartó ayer que pueda hablarse en rigor de que haya dispersión de la izquierda en la campaña electoral, pues Verónika Mendoza, del Frente Amplio, es claramente la candidata del cambio, de la renovación de la política y de la izquierda en el proceso electoral en marcha. (...) Se refirió tácitamente a Susana Villarán, candidata a la vicepresidencia del nacioalista Daniel Urresti: Vladimiro Huaroc que se encuentran en las filas de Keiko Fujimori. Glave citó el caso de Urresti y subrayo que no puede ninguna manera ser considera candidato de izquierda o pregresista, pues representa a un gobierno caracterizado por la influencia decisiva del Ministerio de Economía.|27/12/2015|9637.14|585.93|0|3|Marisa Glave Remy|Gregorio Santos Guerrero|Negativo|2015-12
Web|La República|larepublica.pe|Promesas 2016|No votar por Keiko, ni por Alan, ni por Acuña, ni por Urresti, ni por Toledo, ni por Ántero, ni por Belmont, ni por Gregorio Santos, ni por Yehude, ni por Reggiardo, ni por Nano, ni por Julio Guzmán, ni por Verónika Mendoza, ni por los otros pitufos. Ni en primera ni en segunda vuelta.|27/12/2015|1014.43||0||Renato Cisneros|Gregorio Santos Guerrero|Negativo|2015-12
Web|La República|larepublica.pe|Cambalache - Nelson Manrique|El epicentro de la descomposición política en curso está constituido por el entorno de los colaboradores que rodearon a Susana Villarán en su gestión edil y en la lucha contra la revocatoria. En una breve enumeración destacan los casos de Nano Guerra García, propuesto por Villarán como candidato presidencial de Fuerza Social el 2011, que emigró primero al Partido Humanista de Yehude Simon, para luego recalar como candidato presidencial en el partido de Luis Castañeda Lossio, precisamente uno de los artífices del intento de revocatoria. Vladimiro Huaroc, ex-presidente de Fuerza Social, el partido fundado por Villarán, decidió incorporarse al equipo de Keiko Fujimori. Anel Townsend, dirigente en la campaña contra la revocatoria, se incorporó al partido de César Acuña (Yehude Simon afirmó en Twitter que Susana Villarán lo invitó a sumarse a este proyecto, y su afirmación no ha sido desmentida). Ahora se vocea la incorporación de Susel Paredes y Augusto Rey al partido de PPK. Ya ellos se encargarán de negarlo o confirmarlo.|29/12/2015|1014.43||0||Nelson Manrique|Gregorio Santos Guerrero|Neutro|2015-12
Medio Impreso|Exitosa|Exitosa Diario|""Inclusión de Meche Araóz confirma que Peruanos por el Kambio es el partido de lobbistas""|Entrevista a Marco Arana - Primer vicepresidente del Frente Amplio. Verónika Mendoza aparece en las encuestas con un 2%.¿ Qué evaluación hacen los sondeos? Siempre los consideramos. Estamos empezando la campaña electoral, no tenemos el presupuesto y los recursos de otros, pero creemos que tenemos una excelente candidata. ¿La candidatura de Gregorio Santos les quitará algunos votos? No pues ¡no hay comparación (risas). En principio Verónika Mendoza es una candidata joven con experiencia congresal y está en libertad. Es la única candidata mujer después de Keiko Fujimori.(..) ¿Qué significa la incorporación de Susana Villarán a la plancha de Daniel Urresti?-Me genera lo mismo que la alianza entre Alan y Lourdes, que la alianza entre vilcatoma y Huaroc con Fujimori, que Rospigliosi y PPK, y el señor Acuña con la señora Anel Towsend.(...) Usted señaló que le preocupa que César Acuña gane la presidencia y entre a saquear el estado.- Hay tres cosas graves.Que el señor Acuña está procesado por usar fondos públicos cunado fue alcalde para seguir votod. ¿El Poder Judicial está amarrado de manos o es cómplice? ¿El Jurado Nacional de Elecciones qué dice al respecto?(...) La incorporación de Meche Aráoz solo confirma que a pesar que el señor PPK intenta mostrarse como un hombre de izquierda lo único que muestra es que vuelve a sus orígenes, que es el lobbismo político.|26/12/2015|5696.71|762.28|0|7|Marco Antonio Arana Zegarra|Gregorio Santos Guerrero|Neutro|2015-12
Web|Correo|diariocorreo.pe|Elige tu choro - Miguel E. Santillana|Hace algunas semanas la periodista huancaína Cecilia García Rodríguez lanzó su campaña “chapa tu choro”. La explicación de dicha campaña era que si las autoridades no pueden con la delincuencia, la sociedad tiene que defenderse e incluso darle una pateadura al choro. La campaña se expandió por todo el país y por todos lados se multiplicaron los linchamientos (sea la persona afectada inocente o culpable). Su súbita popularidad la hace candidata al Congreso por PPK.|25/12/2015|702.1||0||Miguel Santillana|Gregorio Santos Guerrero|Negativo|2015-12
Medio Impreso|La República|La República|Perú Wars: El Despertar a la Fuerza - Marco Sifuentes|¿Ya pasaron las náuseas, Perú? ¿O todavía seguimos contemplando con estupor ese chocolateo de lealtades, ese festival de traiciones, esa radiografía del subdesarrollo también conocida como la lista de las 17 planchas de candidatos a la presidencia y vicepresidencia de nuestro país? Más allá del gravol, veamos algunas conclusiones en borrador. –Algo inédito: hasta los pitufos son parte del elenco estable. No hay (casi) pitufos desconocidos. Belmont, Yehude, Nano, Ántero, Goyo, Barnechea o Urresti son personajes que tranquilamente podrían obtener 2%. No les serviría, por supuesto, para pasar la valla del 5%. Así, la mayor amenaza para Keiko Fujimori, en la primera vuelta, no se encuentra en ninguno de los otros 16 candidatos. Estos saben que 1) no tienen forma de desplazarla y 2) les convendría más jugar a ser el mal menor ante Keiko en la segunda vuelta.|23/12/2015|2452.21|292.79|0|5|Marcos Sifuentes|Gregorio Santos Guerrero|Neutro|2015-12
Web|Perú 21|peru21.pe|Carlos Basombrío: Uso y abuso de la presunción de inocencia|Todo esto viene a cuento por la cantidad de personas que hoy se vinculan a la política con procesos e investigaciones abiertas de distinto tipo y para quienes sus partidarios reclaman la presunción de inocencia. Evidentemente, esto es más grave para quienes aspiran a la presidencia. Al menos tres candidatos tienen procesos conocidos. Encabeza, por supuesto, Daniel Urresti, juzgado por homicidio calificado, pero también está César Acuña, con varios procesos judiciales y decenas de investigaciones fiscales, incluyendo lavado de activos.|27/12/2015|1874.83||0||Carlos Miguel Ramón Basombrío Iglesias|Gregorio Santos Guerrero|Negativo|2015-12
Medio Impreso|La República|La República|Cambalache - Nelson Manrique|El travestismo político de las últimas semanas es un momento notable de la crisis de representación que el Perú afronta desde los años 90. En la izquierda se vive el cierre, muy mal procesado, de un ciclo generacional. Por un lado, se ha agotado el impulso de la generación que formó la Izquierda Unida en los 80, después de 25 años de intentos infructuosos de “refundar” la izquierda. Por otro, emerge una nueva generación de dirigentes que mantienen lazos tenues con la generación anterior, cuyos integrantes están entre los 25 y 35 años, en que las mujeres tienen una participación muy destacada: Verónika Mendoza, Marisa Glave, Sigrid Bazán, Claudia Cisneros, y más. (...) El epicentro de la descomposición política en curso está constituido por el entorno de los colaboradores que rodearon a Susana Villarán en su gestión edil y en la lucha contra la revocatoria. En una breve enumeración destacan los casos de Nano Guerra García, propuesto por Villarán como candidato presidencial de Fuerza Social el 2011, que emigró primero al Partido Humanista de Yehude Simon, para luego recalar como candidato presidencial en el partido de Luis Castañeda Lossio, precisamente uno de los artífices del intento de revocatoria. Vladimiro Huaroc, ex-presidente de Fuerza Social, el partido fundado por Villarán, decidió incorporarse al equipo de Keiko Fujimori. Anel Townsend, dirigente en la campaña contra la revocatoria, se incorporó al partido de César Acuña (Yehude Simon afirmó en Twitter que Susana Villarán lo invitó a sumarse a este proyecto, y su afirmación no ha sido desmentida). Ahora se vocea la incorporación de Susel Paredes y Augusto Rey al partido de PPK. Ya ellos se encargarán de negarlo o confirmarlo.|29/12/2015|3594.34|428.44|0|5|Nelson Manrique|Gregorio Santos Guerrero|Neutro|2015-12
Radio|Exitosa|Exitosa Noticias|Fernando Tuesta opinó sobre presentación de Gregorio Santos como candidato presidencial (Exitosa)|Vía telefónica. El experto en temas electorales, Fernando Tuesta Soldevilla, opinó que la reciente presentación a Gregorio Santos como candidato a la presidencia por Democracia Directa se ha dado en el contexto en la inscripciones, luego el JNE las hacen públicas e interponer una tacha bajo cualquier consideración.|23/12/2015|640.71||339||Fernando Tuesta Soldevilla|Gregorio Santos Guerrero|Negativo|2015-12
Medio Impreso|Correo|Correo|Elige tu choro - Miguel E. Santillana|Hace algunas semanas la periodista huancaína Cecilia García Rodríguez lanzó su campaña “chapa tu choro”. (...) Su súbita popularidad la hace candidata al Congreso por PPK. (...) El líder de la “raza distinta” (tan distinta que no se entiende lo que lee) tiene 80 procesos pendientes en La Libertad. AGP (los casos de su primer gobierno prescribieron) no podrá zafarse de los “narcoindultos” y a Lourdes Flores le recordarán que no solo fue abogada de Cataño y presidenta del directorio de su aerolínea. Toledo lleva el sello de Ecoteva en la frente por más que quiera limpiarse con su suegra de 86 años. El partido de los fonavistas (que ha sido denunciado por estafa a los pobres jubilados) lleva a Gregorio Santos, que pasa unas vacaciones en Piedras Gordas por corrupción. Podríamos seguir con cada partido, pero el espacio no alcanza. No pido lincharlos sino analizar bien su voto.|25/12/2015|1205.06|126.05|0|11|Miguel Santillana|Gregorio Santos Guerrero|Negativo|2015-12
Medio Impreso|El Comercio|El Comercio Cuerpo A|2015: El rompecabezas regional - José Carlos Requena|Hasta el colapso del sistema de partidos en los años 80, los bloques regionales eran fácilmente descritos políticamente: el norte era un bastión aprista, mientras la izquierda era fuerte en el sur y el centrista Acción Popular reinaba en la selva. Lima solía votar de acuerdo con el ánimo conservador pepecista. (...) Frente a los aburguesados ex presidentes, Keiko Fujimori y Pedro Pablo Kuczynski (PPK) se “ensuciaban los zapatos”, recorriendo distritos y provincias en todas las regiones, acumulando no solo valiosas enseñanzas, sino también nuevas (¿efímeras?) lealtades y aliados. En CADE 2015, la candidata de Fuerza Popular sacó lustre a sus viajes y exploraciones recientes: inició su presentación mencionando a Curgos, el distrito más pobre del Perú, ubicado en Sánchez Carrión, en la sierra de La Libertad. Asimismo, muchos candidatos se han preocupado por insertar a ex gobernadores regionales en sus planchas presidenciales. Al incorporar a Vladimiro Huaroc, gobernador regional de Junín (2007-2010), la candidata de Fuerza Popular procura un toque experimentado y regional a su apuesta. Con Martín Vizcarra (Moquegua, 2011- 2014), PPK terminó de darle un futuro político a un político con futuro. Quizás por los cambios recientes en la legislación (la máxima autoridad regional no es más un “presidente”), César Acuña (La Libertad, 2015) dejó de ser gobernador regional en octubre: el título al que realmente aspiraba era el de “presidente”. Alan García, en tanto, hace recordar que hubo un presidente regional en Apurímac llamado David Salazar (2007-2010). Y hasta Daniel Urresti recluta a otro ex gobernador regional de nombre tan lejano y ajeno como su región: Maciste Díaz (Huancavelica, 2011 y 2014).|27/12/2015|12216.98|511.79|0|11|José Carlos Requena|Gregorio Santos Guerrero|Neutro|2015-12
Web|La República|larepublica.pe|Alcántara: Candidatura de Santos no está impedida|Gregorio Santos, a pesar de estar privado de su libertad acusado de delitos de corrupción, no tiene impedimento de postular a la Presidencia de la República por Democracia Directa, pues no está sentenciado, afirmó el candidato a la vicepresidencia de esa agrupación política, Andrés Alcántara.. .En ese sentido, adelantó que al no haber pruebas fehacientes en contra de Santos insistirán para que el Poder Judicial ordene su libertad lo antes posible, y pueda iniciar su campaña electoral fuera del penal de Piedras Gordas, donde purga prisión preventiva.|24/12/2015|1014.43||215||Andrés Alcántara Paredes|Gregorio Santos Guerrero|Positivo|2015-12
Medio Impreso|Correo|Correo|Lo real maravilloso del Perú electoral - Luis Rey de Castro|Es probable que el Perú esté cultivando un prestigio digno de novela que supere a Cien años de soledad: donde lo inverosímil es posible y lo imposible es real. El Presidente. Sr. Ollanta Humala, se queja: ""Estoy harto de luchar contra el Estado silueta de elefante"", Es decir que el N°1 del Estado está harto de luchar precisamente contra el Estado que él ha gobernado los últimos cinco años. ¿No es estupendo? El candidato Alejandro Toledo, dueño de Perú Posible, reclama ""decodificar las Lineas de Nasca"" para poder leerlas y gobernar bien el país. Mucho más útil sería decodificar las líneas que van de su amigo Maimana Ecoteva y de allí a su propio patrimonio de inversiones, inmuebles, oficinas y casas playeras. El candidato César Acuña. pese a las advertencias, sigue aprovechando sus universidades, alumnos y otros recursos académicos para hacer campaña. Debe tener alguna ""cuña"" muy bien colocada que le permite seguir riéndose de las leyes electorales. La Sra. Anel Townsend. siempre entusiasmado por los brillos del poder, las embajadas, y ahora por ser Vice-Presidenta, se suma gustosa a la plancha de Acuña, el ""educador de otra raza"", mientras el JNE le recuerda que sigue inscrita en UPP.|27/12/2015|1310.26|137.24|0|11|Luis Rey de Castro|Gregorio Santos Guerrero|Negativo|2015-12
Radio|Capital|Mónica Delta|Entrevista a Luis Benavente de Vox Populi (Capital)|Entrevistal. Luis Benavente, de Vox Populi, se pronunció ante las presentaciones de las planchas electorales y precisó que en un sistema político “más civilizado”, los candidatos se pronuncian por línea política, caso contrario en el Perú. Sostuvo que lo más probable es que algunos se retiren durante la campaña. Asimismo, se refirió a la candidatura de Gregorio Santos, situación ante la cual el JNE, debe tomar una decisión.|21/12/2015|2058||600||Luis Benavente Gianella|Gregorio Santos Guerrero|Neutro|2015-12
Web|Correo|diariocorreo.pe|Macondo electoral - Iván Slocovich|No hay duda de que, con lo visto en las últimas horas en el panorama electoral peruano, la desmesurada y genial imaginación de Gabriel García Márquez, uno de los padres del realismo mágico en Latinoamérica -esa corriente literaria donde lo extraño, absurdo e inimaginable sucede como si nada y sin que nadie levante una ceja-, ha quedado chica, pues las postulaciones de Nano Guerra García, el preso Gregorio Santos y Susana Villarán escapan de todo lo previsible y lógico...Comencemos con Guerra García, quien hasta hace unos días era el casi anónimo precandidato presidencial del Partido Humanista, hasta que el líder de esta agrupación, Yehude Simon, decidió bajarle el dedo por “no hacer clic” con los electores. Ahora el hombre ha sido acogido por Solidaridad Nacional, cuyo dueño parece ser José Luna, quien antes quiso aliarse con Pedro Pablo Kuczynski, pero fue rechazado por pedir demasiado a cambio de aportar poco o nada a los “pepekausas”.|21/12/2015|702.1||0||Iván Slocovich Pardo|Gregorio Santos Guerrero|Neutro|2015-12
Medio Impreso|La República|La República|Andrés Alcántara: “No me cabe duda de que Gregorio Santos es un preso político de las trasnacionales”|Entrevista a Andrés Alcántara, presidente de Asociación de Fonavistas e integrante de la plancha de Gregorio Santos. -Su candidato presidencial es el exgobernador regional de Cajamarca Gregorio Santos. Él actualmente está preso en Piedras Gordas y se le acusa por presuntos delitos de cohecho pasivo, asociación ilícita para delinquir y colusión en agravio del Estado. ¿Cómo van a lograr todas sus propuestas? Esos son ataques de la prensa y del Poder Judicial. Eso es lo que uno se gana por enfrentarse a las trasnacionales. Gregorio Santos no tiene sentencia. Él está preso por subjetividad, porque creen que se puede fugar del país. Toda persona es considerada inocente mientras no se haya declarado judicialmente su responsabilidad. -Bueno, entonces le hago otra pregunta. Señor Alcántara, ¿usted recibe mensualmente un sueldo por ser presidente de la Asociación de Fonavistas? Eso es un tema personal. ¿Acaso eres del servicio de inteligencia del Ministerio de Economía y Finanzas?.. . .|28/12/2015|4037.92|829.31|0|10|Andrés Alcántara Paredes|Gregorio Santos Guerrero|Positivo|2015-12
Radio|Exitosa|Exitosa Noticias|Democracia Directa presentó a Gregorio Santos como candidato a la presidencia (Exitosa)|Despacho. Desde la Plaza San Martín, los integrantes de Democracia Directa presentaron a Gregorio Santos como candidato a la presidencia de la República. Andrés Alcántara, candidato a la primera vicepresidencia, aseguró que Santos cumple una condena a raíz de un abuso de las autoridades.|23/12/2015|614.25||325||Andrés Alcántara Paredes|Gregorio Santos Guerrero|Positivo|2015-12
Web|El Comercio|elcomercio.pe|""2015: El rompecabezas regional"", por José Carlos Requena|Mientras en Lima la escena nacional se ve poblada de cerca de 20 planchas presidenciales y mutaciones políticas sorpresivas, en regiones se ven crecientemente espacios que son gobernados por dos tendencias marcadamente distintas. En enero, por ejemplo, Fuerza Popular tomó brevemente la alcaldía provincial de Cajamarca para convivir con el Movimiento de Afirmación (MAS) del encarcelado Gregorio Santos, que ganó la gobernación regional. La aparente bipolaridad fue breve: el alcalde Manuel Becerra, el transitorio fujimorista, renunció a Fuerza Popular a fines de abril. En noviembre, Becerra empezó a apoyar a César Acuña.|27/12/2015|5994.53||0||José Carlos Requena|Gregorio Santos Guerrero|Neutro|2015-12
Medio Impreso|Gestión|Gestión|Patria Roja reniega de Santos|Patria Roja no le perdona a Gregorio Santos el haberse convertido en el candidato presidencial de Democracia Directa y haberlos dejado ‘tirando cintura’. Para Bladimiro Begazo, dirigente de la agrupación izquierdista, el cajamarquino “acaba de cometer el peor error de su vida y sepultar una carrera política que auguraba buenas perspectivas”. ¿Qué le deparará el destino a Santos?.|28/12/2015|553.09|37.42|0|27|Bladimiro Begazo|Gregorio Santos Guerrero|Negativo|2015-12
