Web|La República|larepublica.pe|Perú Wars: El Despertar a la Fuerza - Marco Sifuentes|–Alfredo Barnechea tiene suficientes contactos en los medios como para obtener valiosos minutos de exposición en televisión. Si hay un nicho de votantes que busca a alguien que “hable bonito” pero no quiere votar por el candidato de los narcoindultos, aquí tiene a su hombre. La verdad, si lo pusieran a debatir con gente como Acuña, Barnechea quedaría como Churchill. Con un equipo de campaña sólido, también podría pasar la valla.|23/12/2015|1014.43||0||Marcos Sifuentes|Gregorio Santos Guerrero|Neutro|2015-12
Web|Perú 21|peru21.pe|Alditus was right! - Aldo Mariátegui|(...) Sigamos con las arcadas como cancha: ¿qué hace un rojo de toda la vida como Huaroc con Keiko? ¿Qué hace una roja supuestamente consecuente como Rosa Mavila aliada con Yehude “Baguazo” Simon, divisionista de la izquierda y ex aliado aprista, ppkausa y toledista, amén de preso por vínculos con el MRTA? ¿Qué hace el maoísta de Patria Roja Gregorio Santos de aliado del fonavista Andrés Alcántara después de que este maltrató así al siomista García Núñez y todo ese sector de viejos de la izquierda? ¿Qué hace Lourdes Flores al lado de Alan después de que ella, a comienzos de los 90, probara todas las acusaciones contra este por BCCI, Mirages, etc…? ¿Qué hace un jurista respetable como Marco Ibazeta de compañero de fórmula de Belmont? ¿Qué hace un religioso como el pastor Lay al lado de un tipo como Acuña? ¿Tan desesperado está Solidaridad para no ir a la baja que recurre al recién choteado ‘Nano’? ¿Reggiardo, Barnechea, Guzmán, Pancho Diez Canseco y Popy creen de verdad que tienen alguna chance? ¿De dónde ha sacado Popy ese extravagante corte de pelo medieval?|22/12/2015|1874.83||0||Aldo Mariátegui Bosse|Gregorio Santos Guerrero|Negativo|2015-12
Medio Impreso|Perú 21|Perú 21|¡Gracias, Carlín! - Aldo Mariátegui|Según bien me orientó el caricaturista marxista Carlín, Susana Villarán no es la única arma secreta con la que cuenta la derecha contra la izquierda: la “bomba H” antizurda es en realidad Andrés Alcántara, ese flautista de Hamelin que ahora ha optado por la política tras manipular por años a los viejitos con el espejismo del Fonavi. Como Alcántara cuenta con un “partido” inscrito ante el JNE, primero logró que el congresista Sergio Tejada se uniera a él, jalándose, además, a los siomistas de Ciudadanos x el Cambio y lo que queda del PCP moscovita y el PS de Mocha y JDC. Estos candorosos izquierdistas acordaron ir a primarias con Alcántara para dilucidar quién sería su candidato presidencial y el buen Andrés limpió el piso con su contendor Gonzalo García Núñez, quien pateó el tablero y no quiso reconocer la victoria de nuestra arma secreta. Al final, humillados y ofendidos, este sector ha tenido que ir a besarle los pies al cura Arana a ver si este se digna a darles puestos en la lista congresal del Frente Amplio, que encabeza la chavista francoperuana Verónika Mendoza. Deshecho este sector de la izquierda, nuestra arma secreta volteó sus ojos a Gregorio Santos y Patria Roja, causando otro cisma entre estos al caer Gregorio en sus cantos de sirena y pelearse con sus camaradas maoístas, quedando por verse si el JNE le va a autorizar a candidatear, cosa complicada debido a que está preso.|31/12/2015|1810.54|172.97|0|11|Aldo Mariátegui Bosse|Gregorio Santos Guerrero|Neutro|2015-12
Medio Impreso|Perú 21|Perú 21|Por favor, desconectar - Beto Ortiz|Hoy, sin embargo, como me tocaba escribir, sucumbí a la tentación, rompí el ayuno y me metí a curiosear qué había pasado en mi país en tan prolongada ausencia. (...) Me encontré con que sujetos de la catadura del nefasto Popy Olivera, el matacabros Ricardo Belmont y el tirapiedra Goyo Santos inscribieron sus candidaturas presidenciales. Con que la reina de las malaguas Susana Villarán es ahora la vice de Urresti, con que la suprema arribista Anel Townsend logró trepar hasta vice de Acuña y la regia de regias, la tremenda jueza Carolina Lizárraga, es la nueva amiwi de Forever Alone Guzmán. (...) Ya se sabe que la Constitución establece que cualquier huevada puede postular, pero tampoco se maleen así, por mi madre-.Qué papelón. Que el siniestro ministro de Justicia del Cholo Sagrado, el inenarrable Olivera, la haya librado después de sus archiconocidas tropelías y conspiraciones contra Beatriz Merino, contra Cipriani y contra medio Perú, que hayan pasado piolaza sus nunca investigadas movidas “empresariales” cuando era embajador en España , vaya y pase.|27/12/2015|7873.74|748.68|0|11|Humberto Martín Ortiz Pajuelo|Gregorio Santos Guerrero|Negativo|2015-12
Web|La República|larepublica.pe|Fotocheck de apuestas riesgosas|Verónika Mendoza. La campaña la va a foguear. ¿Pero cómo es el futuro de los ex candidatos en la izquierda? Hagamos memoria. Va a tener que luchar mucho para conservar su peso político cinco años en el llano, aunque para lograr eso existen recursos. En el fondo a Marco Arana le fue mucho mejor perdiendo la elección interna. .|27/12/2015|1014.43||0||Mirko Lauer|Gregorio Santos Guerrero|Neutro|2015-12
Web|Correo|diariocorreo.pe|Fuera los terrucos - Iván Slocovich|Si ya tenemos una contienda electoral propia de una novela salida del realismo mágico con Susana Villarán al lado de Daniel Urresti, Anel Townsend cambiándose nuevamente de camiseta y a Gregorio Santos haciendo campaña presidencial desde el patio de Piedras Gordas; cuidado con que en medio de todo esto el Jurado Nacional de Elecciones (JNE) acepte la inscripción de una agrupación de fachada de la banda terrorista Sendero Luminoso.|23/12/2015|702.1||0||Iván Slocovich Pardo|Gregorio Santos Guerrero|Negativo|2015-12
Medio Impreso|La República|La República|Alcántara: Candidatura de Santos no está impedida|Gregorio Santos, a pesar de estar privado de su libertad acusado de delitos de corrupción, no tiene impedimento de postular a la Presidencia de la República por Democracia Directa, pues no está sentenciado, afirmó el candidato a la vicepresidencia de esa agrupación política, Andrés Alcántara. En ese sentido, adelantó que al no haber pruebas fehacientes en contra de Santos insistirán para que el Poder Judicial ordene su libertad lo antes posible, y pueda iniciar su campaña electoral fuera del penal de Piedras Gordas, donde purga prisión preventiva. El acto se realizó en la Plaza San Martín, donde todos los miércoles se reúnen decenas de fonavistas. Esta vez también estuvieron los militantes del MAS.|24/12/2015|505.55|86.04|0|9|Andrés Alcántara Paredes|Gregorio Santos Guerrero|Positivo|2015-12
Web|Correo|diariocorreo.pe|Lo real maravilloso del Perú electoral|El candidato César Acuña, pese a las advertencias, sigue aprovechando sus universidades, alumnos y otros recursos académicos para hacer campaña. Debe tener alguna “cuña” muy bien colocada que le permite seguir riéndose de las leyes electorales.|27/12/2015|702.1||0||Luis Rey de Castro|Gregorio Santos Guerrero|Negativo|2015-12
